{
  "version": 1,
  "timestamp": "2024-01-15T10:30:00.000Z",
  "subject": "Email with Multiple Recipients",
  "body": "This email goes to multiple recipients.",
  "bodyFormat": "plain",
  "recipients": {
    "to": [
      {
        "name": "John Doe",
        "address": "john@example.com"
      },
      {
        "name": "Jane Smith",
        "address": "jane@example.com"
      }
    ],
    "cc": [
      {
        "name": "Manager",
        "address": "manager@example.com"
      }
    ],
    "bcc": [
      {
        "name": "Admin",
        "address": "admin@example.com"
      }
    ]
  },
  "attachments": [],
  "originApp": "outlook.exe"
}
