{
  "version": 1,
  "timestamp": "2024-01-15T10:30:00.000Z",
  "subject": "Email with Unicode: café résumé",
  "body": "This email contains unicode characters: Åke, résumé, naïve, 你好",
  "bodyFormat": "plain",
  "recipients": {
    "to": [
      {
        "name": "José García",
        "address": "jose@example.com"
      }
    ],
    "cc": [],
    "bcc": []
  },
  "attachments": [],
  "originApp": "notepad.exe"
}
