{
  "version": 1,
  "timestamp": "2024-01-15T10:30:00.000Z",
  "subject": "Simple Test Email",
  "body": "This is a simple test email with no attachments.",
  "bodyFormat": "plain",
  "recipients": {
    "to": [
      {
        "name": "John Doe",
        "address": "john@example.com"
      }
    ],
    "cc": [],
    "bcc": []
  },
  "attachments": [],
  "originApp": "explorer.exe"
}
