{
  "version": 1,
  "timestamp": "2024-01-15T10:30:00.000Z",
  "subject": "Email with Attachment",
  "body": "This email contains an attachment.",
  "bodyFormat": "plain",
  "recipients": {
    "to": [
      {
        "name": "Jane Smith",
        "address": "jane@example.com"
      }
    ],
    "cc": [],
    "bcc": []
  },
  "attachments": [
    {
      "filename": "document.pdf",
      "path": "C:\\Users\\test\\Documents\\document.pdf",
      "size": 102400
    }
  ],
  "originApp": "adobe.exe"
}
